{
  "$schema": "https://schema.evideris.com/derived/schemas/epa.schema.json",
  "$id": "https://schema.evideris.com/derived/epa/emr-cln/independent-piecemeal.v1.0.0.json",
  "lineageId": "epa-emr-cln-independent-piecemeal",
  "type": "epa",
  "version": "1.0.0",
  "release": "r2026.07",
  "supersedes": null,
  "supersededBy": null,
  "language": ["en"],

  "derivedFromCurriculum": "cur-emr-colon-2023",
  "modality": "m-colonoscopy-emr",

  "title": { "en": "Performs piecemeal EMR of a large non-pedunculated colorectal polyp (LNPCP) independently" },
  "description": {
    "en": "End-to-end performance of a piecemeal EMR — from lesion assessment and informed consent through resection, defect inspection, thermal margin ablation, and post-procedure communication — to a standard a supervisor can entrust unsupervised."
  },

  "competencyRefs": [
    "c-emr-cln-lesion-assessment",
    "c-emr-cln-smi-risk-stratification",
    "c-emr-cln-submucosal-injection",
    "c-emr-cln-snare-capture",
    "c-emr-cln-post-emr-defect-inspection",
    "c-emr-cln-thermal-margin-ablation",
    "c-emr-cln-bleeding-management",
    "c-emr-cln-patient-consent-discussion"
  ],

  "trustLevels": [
    { "value": 1, "label": { "en": "Observe only — no execution" } },
    { "value": 2, "label": { "en": "Act under proactive supervision — supervisor in room and engaged" } },
    { "value": 3, "label": { "en": "Act under reactive supervision — supervisor immediately available" } },
    { "value": 4, "label": { "en": "Act unsupervised" } },
    { "value": 5, "label": { "en": "May supervise others performing this EPA" } }
  ],

  "requiredExposure": {
    "minProcedures": 30,
    "minPeriodMonths": 6,
    "stratifiedBy": "st-smsa"
  },

  "derivedFromMainStatement": 10,

  "_meta": {
    "provenance": {
      "type": "evideris-design",
      "reason": "Forward-design EPA by David Tate as ESGE Curriculum committee member. Tate EMR 2023 does NOT formally enumerate EPAs; this is Evideris's articulation of what entrustable independent EMR practice looks like, based on Main Statement 10 (30-procedure / 6-month / SMSA-stratified competency assessment).",
      "derived_from": ["cur-emr-colon-2023", "rec-emr-cln-r37-completion-training-emr"]
    },
    "encodedBy": "human:david",
    "encodedAt": "2026-06-28"
  }
}
